uuid|id|title|authors|isbn|publisher|published_date|status|last_updated
86D27EB3-9E65-6637-E683-DF69F06FFD6D|1|dui. Suspendisse ac metus vitae velit egestas lacinia. Sed congue,|Frances Woodard|BRP55DTY7TD|Sean Z. Berger|1967|available|Sat Dec 06 22:00:42 EAT 2013
CD768C7E-091C-4623-1EFB-91300A2ABC4A|2|ultrices sit amet, risus. Donec nibh enim, gravida sit amet,|Ingrid Murray|WZS36HCN1NQ|Bo Pitts|1968|available|Sat Dec 06 22:00:42 EAT 2013
B979247F-25CD-AA0E-73FE-C8BEF0192667|3|vel nisl. Quisque fringilla euismod enim. Etiam gravida molestie arcu.|Wade Mills|GBI47GRV7WO|Eaton Y. Carey|1969|available|Sat Dec 06 22:00:42 EAT 2013
BD90475B-1A81-43E8-80E5-02687DE78960|4|et, commodo at, libero. Morbi accumsan laoreet ipsum. Curabitur consequat,|Jacob Gentry|AWF47TFM7TM|Zane I. Garza|1970|available|Sat Dec 06 22:00:42 EAT 2013
581BB801-B261-9D88-F9B5-B0130938EF2D|5|lorem, eget mollis lectus pede et risus. Quisque libero lacus,|Bethany Humphrey|UEX50ZYN6GM|Quamar Case|1971|available|Sat Dec 06 22:00:42 EAT 2013
5CD4093D-EEC1-2E42-B336-2257D1A9AC00|6|purus, in molestie tortor nibh sit amet orci. Ut sagittis|Tasha Payne|OFW20LOQ8JA|Amelia V. Hooper|1972|available|Sat Dec 06 22:00:42 EAT 2013
D59ED36E-810E-4EB4-7FFA-FA144FC80175|7|arcu. Curabitur ut odio vel est tempor bibendum. Donec felis|Xerxes Dejesus|GLU28MKK3VU|Maia D. Conley|1973|available|Sat Dec 06 22:00:42 EAT 2013
4C50A5C5-4090-4BDC-DB6D-9FB390EA4314|8|metus eu erat semper rutrum. Fusce dolor quam, elementum at,|Jayme Kerr|EGQ89SGJ5KO|Scott Holland|1974|available|Sat Dec 06 22:00:42 EAT 2013
8CF00B62-CAE2-2052-2730-B72283A53F93|9|at, velit. Pellentesque ultricies dignissim lacus. Aliquam rutrum lorem ac|Timon Cruz|ICG48AJF8JQ|Jacqueline N. Houston|1975|available|Sat Dec 06 22:00:42 EAT 2013
6ABA296A-11CB-354C-276D-9C932175E6C3|10|vel nisl. Quisque fringilla euismod enim. Etiam gravida molestie arcu.|Yoko Church|AAX01NMR1HW|Nora Austin|1976|available|Sat Dec 06 22:00:42 EAT 2013
AC57C1E6-FA3B-F47B-DF86-BC2B36DF56C7|11|lorem ac risus. Morbi metus. Vivamus euismod urna. Nullam lobortis|Quinn Reese|WUI57GGD6XD|Lilah Obrien|1977|available|Sat Dec 06 22:00:42 EAT 2013
17CD2763-6163-347F-DE05-0B77D6841A2E|12|amet lorem semper auctor. Mauris vel turpis. Aliquam adipiscing lobortis|Rahim Hendrix|DWK18TVJ7AQ|Callum O. Finley|1978|available|Sat Dec 06 22:00:42 EAT 2013
75CBF522-8541-0A34-AC9B-BB64E79D3903|13|magna. Praesent interdum ligula eu enim. Etiam imperdiet dictum magna.|Clementine Reyes|CRR97WGW1RR|Magee Y. Stuart|1979|available|Sat Dec 06 22:00:42 EAT 2013
A93E6794-99E7-9490-EDE0-3A17214590AB|14|velit. Pellentesque ultricies dignissim lacus. Aliquam rutrum lorem ac risus.|Hamilton Duke|QEY81HUL3IP|Scott R. Anderson|1980|available|Sat Dec 06 22:00:42 EAT 2013
847E6524-94C3-4837-AAE1-5F02C47A8228|15|Aliquam rutrum lorem ac risus. Morbi metus. Vivamus euismod urna.|Illana Woods|SKX30DML0RK|Vladimir Greer|1981|available|Sat Dec 06 22:00:42 EAT 2013
C57E4B65-48AD-B5DD-50D0-D2180D6750E0|16|accumsan laoreet ipsum. Curabitur consequat, lectus sit amet luctus vulputate,|Cecilia Roth|AAT70XBA2XA|Julian Hunter|1982|available|Sat Dec 06 22:00:42 EAT 2013
8D6C81CA-D65B-C70E-5F25-556F27EE8FA4|17|mattis. Integer eu lacus. Quisque imperdiet, erat nonummy ultricies ornare,|Kelly Watts|WDI82HBU2FD|Forrest Combs|1983|available|Sat Dec 06 22:00:42 EAT 2013
759DD97E-BBFD-671E-0B61-6E3163AFD6B4|18|et magnis dis parturient montes, nascetur ridiculus mus. Donec dignissim|Kuame Francis|WPL66EQA1FV|Adrienne E. Harrell|1984|available|Sat Dec 06 22:00:42 EAT 2013
1A5BAEB8-B02D-51A9-1D51-89C5359D2D32|19|Vivamus sit amet risus. Donec egestas. Aliquam nec enim. Nunc|Dexter Ortega|IIK75RIY3HO|Naomi G. Bass|1985|available|Sat Dec 06 22:00:42 EAT 2013
2EBD2A87-8A3B-A0E7-B9C0-CF8239A0A1DC|20|Cras vehicula aliquet libero. Integer in magna. Phasellus dolor elit,|Joelle Larsen|TQN75DKY1ZJ|Allen Wilkinson|1986|available|Sat Dec 06 22:00:42 EAT 2013
337DA90F-7B9F-20D6-BF23-0C20D49D6FB7|21|nisl. Quisque fringilla euismod enim. Etiam gravida molestie arcu. Sed|Tanek Hendricks|TQF07ZRW5AR|Kessie Carlson|1987|available|Sat Dec 06 22:00:42 EAT 2013
32514563-A782-35DC-0176-135BA8947029|22|risus. Nulla eget metus eu erat semper rutrum. Fusce dolor|Howard Joyner|OXV69MVQ6RA|Sara O. Merrill|1988|available|Sat Dec 06 22:00:42 EAT 2013
0AF45AE3-82D6-463E-0671-E609E049D7E1|23|dui lectus rutrum urna, nec luctus felis purus ac tellus.|Diana Webster|JUM49VSA5YN|Alea R. Schwartz|1989|available|Sat Dec 06 22:00:42 EAT 2013
87BEEBA6-9F74-847E-7C69-5408A6F32DA4|24|dictum ultricies ligula. Nullam enim. Sed nulla ante, iaculis nec,|Laura Lindsey|EGZ05AWI1YT|Abigail Alford|1990|available|Sat Dec 06 22:00:42 EAT 2013
DA63729E-2DE5-DA1C-FADD-0C3FDB7D8DE6|25|nunc sit amet metus. Aliquam erat volutpat. Nulla facilisis. Suspendisse|Emma Patrick|MJK29KIV1UM|Ulric Fields|1991|available|Sat Dec 06 22:00:42 EAT 2013
C17AFE19-8E69-AC93-2EEA-552D93252B18|26|pharetra. Nam ac nulla. In tincidunt congue turpis. In condimentum.|Reese Logan|YGZ56QXV8FQ|Kessie Stephens|1992|available|Sat Dec 06 22:00:42 EAT 2013
5EA96DB6-BAB1-C140-8C25-8EC25F59C295|27|senectus et netus et malesuada fames ac turpis egestas. Fusce|Madonna Salas|SFA82BGO9XK|Jonas Cochran|1993|available|Sat Dec 06 22:00:42 EAT 2013
A86D7317-10F1-A4F7-ED8A-1E5D5F72C378|28|consequat auctor, nunc nulla vulputate dui, nec tempus mauris erat|Carol Dalton|RQD66HQO6GG|Hashim L. Garrison|1994|available|Sat Dec 06 22:00:42 EAT 2013
6C1E3226-EC84-186E-598A-EC06494A8F57|29|dui. Suspendisse ac metus vitae velit egestas lacinia. Sed congue,|Sonya Frost|JHI74ZRD2TG|Rina Moon|1995|available|Sat Dec 06 22:00:42 EAT 2013
EB0EAEC9-1B22-A6B9-E295-FAA78166CDFA|30|pede nec ante blandit viverra. Donec tempus, lorem fringilla ornare|Zahir Rodriguez|FZO14XVX9QN|Genevieve P. Morton|1996|available|Sat Dec 06 22:00:42 EAT 2013
BB9BB0C8-4BC7-6491-AE0D-85FE33304004|31|sed dui. Fusce aliquam, enim nec tempus scelerisque, lorem ipsum|Bell Villarreal|VZJ95GII7TC|Cherokee P. Kelley|1997|available|Sat Dec 06 22:00:42 EAT 2013
50534AE8-9802-57A2-7D03-8E32D1B863CB|32|non enim commodo hendrerit. Donec porttitor tellus non magna. Nam|Kyle Hammond|MRU22CEU8OQ|Ryan B. Hoffman|1998|available|Sat Dec 06 22:00:42 EAT 2013
467085DE-DCF8-60CF-D168-45983139F96F|33|ac urna. Ut tincidunt vehicula risus. Nulla eget metus eu|Olga Mcdowell|NQF51QGM1MQ|Phillip E. Mccullough|1999|available|Sat Dec 06 22:00:42 EAT 2013
DAA4FF66-AFFA-CFD6-BDEB-1C26F9E4504D|34|Curae; Donec tincidunt. Donec vitae erat vel pede blandit congue.|Yvonne Williamson|IZN01FCU4SG|Odessa I. Hunt|2000|available|Sat Dec 06 22:00:42 EAT 2013
A6C612A5-4644-00E1-52F1-15969B0A8324|35|nec mauris blandit mattis. Cras eget nisi dictum augue malesuada|Cedric Baldwin|GFS73JTH4KN|Oscar Jordan|2001|available|Sat Dec 06 22:00:42 EAT 2013
22046207-808F-8851-F4D2-35F8C622E85E|36|rhoncus. Nullam velit dui, semper et, lacinia vitae, sodales at,|Hyacinth Noble|OBB50XBQ0BU|Austin N. Ortiz|2002|available|Sat Dec 06 22:00:42 EAT 2013
11E783EF-2582-6749-985B-3EE1B8634C0A|37|Aliquam gravida mauris ut mi. Duis risus odio, auctor vitae,|Burton Coleman|XFP70FJB5KE|Prescott U. Gonzales|1977|available|Sat Dec 06 22:00:42 EAT 2013
B790DAF8-C480-8E72-FA5D-594F5636C151|38|a odio semper cursus. Integer mollis. Integer tincidunt aliquam arcu.|Zahir Bruce|ZQP87LVY3HG|Ima Y. Carney|1978|available|Sat Dec 06 22:00:42 EAT 2013
633F074B-955F-5FB6-F355-A0D9C8368F37|39|Morbi vehicula. Pellentesque tincidunt tempus risus. Donec egestas. Duis ac|Carol Carney|ZOO21BVP0OP|Katelyn Hamilton|1979|available|Sat Dec 06 22:00:42 EAT 2013
DBD126ED-B070-61E7-5EE4-9400C6289912|40|eu arcu. Morbi sit amet massa. Quisque porttitor eros nec|Pamela Parsons|CUP60AZQ9SG|Callie Simmons|1980|available|Sat Dec 06 22:00:42 EAT 2013
9F7CFAC1-A739-6EF3-7241-F799933E1E93|41|at auctor ullamcorper, nisl arcu iaculis enim, sit amet ornare|Melyssa Rivers|TAG67GRK1ZA|Cairo M. Haney|1981|available|Sat Dec 06 22:00:42 EAT 2013
3B0F9CB2-7F9C-F019-DAC3-C5ACEACED152|42|justo sit amet nulla. Donec non justo. Proin non massa|Martin Potter|VHM84QGI1QH|Yasir Valenzuela|1982|available|Sat Dec 06 22:00:42 EAT 2013
DC4ADEB7-DA36-A94A-E506-C4C22A6769B0|43|non magna. Nam ligula elit, pretium et, rutrum non, hendrerit|Megan Bernard|VQM88STR8MD|Gail Downs|1983|available|Sat Dec 06 22:00:42 EAT 2013
6C2B3F29-2EAF-9E08-D03C-CD28E1453084|44|sit amet risus. Donec egestas. Aliquam nec enim. Nunc ut|Vance Donaldson|XFQ94WBU3EK|Zahir P. Mooney|1984|available|Sat Dec 06 22:00:42 EAT 2013
7A8F9137-FE70-CE03-697D-8BA9B289B46A|45|eros non enim commodo hendrerit. Donec porttitor tellus non magna.|Russell Kelly|TOV05JAO8KG|Jarrod H. Harding|1985|available|Sat Dec 06 22:00:42 EAT 2013
482807BF-D130-70D2-D5C0-B1044FEDEE45|46|tincidunt orci quis lectus. Nullam suscipit, est ac facilisis facilisis,|Zenia Ballard|WIF30CPI4IU|Cailin E. Acosta|1986|available|Sat Dec 06 22:00:42 EAT 2013
86440196-C2F1-76E8-5F5E-1527091BF91E|47|at auctor ullamcorper, nisl arcu iaculis enim, sit amet ornare|Gail Holland|GPQ41NLE3WT|Bernard Craig|1987|available|Sat Dec 06 22:00:42 EAT 2013
DEA6C40F-1157-E21C-510B-5AC9AC6CC785|48|Donec luctus aliquet odio. Etiam ligula tortor, dictum eu, placerat|Nathan Tillman|YDV55TMR2QI|Hedley P. Rice|1988|available|Sat Dec 06 22:00:42 EAT 2013
2427C536-1AE8-8F87-CCDC-E49E7B0675AC|49|velit. Pellentesque ultricies dignissim lacus. Aliquam rutrum lorem ac risus.|Graham Ramirez|YPK08WFD9LA|Ori Ferrell|1989|available|Sat Dec 06 22:00:42 EAT 2013
B7F1AB7A-F12E-EC39-28C3-300B965CFA56|50|vulputate mauris sagittis placerat. Cras dictum ultricies ligula. Nullam enim.|Olympia Jefferson|JSO98DCL5VG|Brady Y. Reed|1990|available|Sat Dec 06 22:00:42 EAT 2013
C73C6B54-F075-C03E-B8F4-0CC7F0665BA5|51|cursus. Integer mollis. Integer tincidunt aliquam arcu. Aliquam ultrices iaculis|Chanda Turner|XJK73MMX6UW|Boris Hinton|1991|available|Sat Dec 06 22:00:42 EAT 2013
44419F85-CFCE-6F98-CEF3-D529D55CA68B|52|quis diam luctus lobortis. Class aptent taciti sociosqu ad litora|Brynn Mcclure|WFI68COV5HG|Sharon V. Parrish|1992|available|Sat Dec 06 22:00:42 EAT 2013
2A7B6D56-A7E8-4021-FC3D-D79A60237162|53|malesuada. Integer id magna et ipsum cursus vestibulum. Mauris magna.|Griffin Floyd|KNS77XPM3EL|Baker Contreras|1993|available|Sat Dec 06 22:00:42 EAT 2013
C81376E2-5758-C4EF-CD39-3206E5193C9A|54|aliquam, enim nec tempus scelerisque, lorem ipsum sodales purus, in|Bevis Charles|EZI94NDT7PX|Timothy D. Coffey|1994|available|Sat Dec 06 22:00:42 EAT 2013
E3E3B9B2-4406-F290-1992-611EC283BDFF|55|sit amet ornare lectus justo eu arcu. Morbi sit amet|Yardley Colon|CLS68VFK3SY|Rylee R. Morrow|1995|available|Sat Dec 06 22:00:42 EAT 2013
E3D121A9-FFB0-B282-64B0-C3916686DADF|56|ultrices, mauris ipsum porta elit, a feugiat tellus lorem eu|Phelan Holman|SPJ56GPT8RC|Erica E. Richmond|1977|available|Sat Dec 06 22:00:42 EAT 2013
8A236681-85CD-A47F-5F2B-C478CBF8A2D0|57|tincidunt vehicula risus. Nulla eget metus eu erat semper rutrum.|Clementine Beck|QFG74JYM0HG|Dara Howard|1978|available|Sat Dec 06 22:00:42 EAT 2013
5D7C23F6-FAF7-811B-864A-20F6D2B991D6|58|neque tellus, imperdiet non, vestibulum nec, euismod in, dolor. Fusce|Deirdre Garrett|VGQ90MVA4EJ|Emery Cantu|1979|available|Sat Dec 06 22:00:42 EAT 2013
A2ED2683-7CDB-D74B-207B-FE7A117FC186|59|dictum. Proin eget odio. Aliquam vulputate ullamcorper magna. Sed eu|Slade Skinner|MGR37PUV7AV|Abigail Carr|1980|available|Sat Dec 06 22:00:42 EAT 2013
7318109C-F65A-0958-E9F9-D18B328A7A34|60|Aliquam erat volutpat. Nulla dignissim. Maecenas ornare egestas ligula. Nullam|Kenneth Ball|MOV13BJX8IH|Lila H. Snow|1981|available|Sat Dec 06 22:00:42 EAT 2013
0FCA969E-28C9-9661-6BC2-E991930EC4BC|61|laoreet posuere, enim nisl elementum purus, accumsan interdum libero dui|Hayes Owen|FDU56YVS4XN|Whilemina J. Frank|1982|available|Sat Dec 06 22:00:42 EAT 2013
3B89C0FF-419F-9FFA-7C0C-18A6E64DD5AE|62|blandit at, nisi. Cum sociis natoque penatibus et magnis dis|Claire Wolfe|YFQ94DIK2DA|Jada Fitzpatrick|1983|available|Sat Dec 06 22:00:42 EAT 2013
9840CBF3-4F47-483E-D850-DB4555135230|63|a purus. Duis elementum, dui quis accumsan convallis, ante lectus|Brody Cardenas|BYX56WUJ8BK|Curran Booker|1984|available|Sat Dec 06 22:00:42 EAT 2013
0A4839FD-46AD-899D-49B6-A25F31636C2D|64|pretium neque. Morbi quis urna. Nunc quis arcu vel quam|Phoebe Duffy|VJI42WIX1BD|Audrey Wiggins|1985|available|Sat Dec 06 22:00:42 EAT 2013
DD5BBDAE-6451-1B09-C2B7-D456AA7B590F|65|Suspendisse ac metus vitae velit egestas lacinia. Sed congue, elit|Chantale Decker|WLU96PSR4CU|Sloane Boyer|1986|available|Sat Dec 06 22:00:42 EAT 2013
42FA656E-CA2F-1C4D-4F79-03A6EF4BE9D6|66|vulputate eu, odio. Phasellus at augue id ante dictum cursus.|Byron Ortega|TLR81TRJ4BD|Tobias E. Craig|1987|available|Sat Dec 06 22:00:42 EAT 2013
78B17844-F652-42C0-FE3E-226832F18A94|67|sit amet lorem semper auctor. Mauris vel turpis. Aliquam adipiscing|Martena Ballard|FGU50SPF3RO|Nash H. Mcleod|1988|available|Sat Dec 06 22:00:42 EAT 2013
8AC35BCD-DBB7-4A85-920C-DCAFA543A11F|68|tempus, lorem fringilla ornare placerat, orci lacus vestibulum lorem, sit|Iola Huffman|ALD04NOZ7CB|Noble Simon|1989|available|Sat Dec 06 22:00:42 EAT 2013
9691A6C1-D478-F8DB-71F4-A521B2968B53|69|et libero. Proin mi. Aliquam gravida mauris ut mi. Duis|Angela Lowe|JAL84OOJ4CT|Genevieve T. Parrish|1990|available|Sat Dec 06 22:00:42 EAT 2013
705D2B4C-AB42-48E8-682B-A8D7654CDF29|70|Mauris ut quam vel sapien imperdiet ornare. In faucibus. Morbi|Malik Daugherty|HEV24UXC8DB|Michael Cooley|1991|available|Sat Dec 06 22:00:42 EAT 2013
69CC173E-5B91-CCEA-3306-61F448F15089|71|euismod enim. Etiam gravida molestie arcu. Sed eu nibh vulputate|Alvin Soto|GXZ29UDO5WA|Gretchen L. Dean|1992|available|Sat Dec 06 22:00:42 EAT 2013
7EB39151-6F89-0E65-B014-DED9F479AAB2|72|Nunc ut erat. Sed nunc est, mollis non, cursus non,|Maite Lawrence|ZLA36OAF0DT|Hedda Velasquez|1993|available|Sat Dec 06 22:00:42 EAT 2013
0732F270-7161-E1B3-5314-8CD499DCD607|73|Aenean eget magna. Suspendisse tristique neque venenatis lacus. Etiam bibendum|Jaime Young|ULE66LUV6CV|Shad Mckinney|1994|available|Sat Dec 06 22:00:42 EAT 2013
1F012C68-9E5A-2A79-B903-2D0FFF9CD484|74|tellus. Suspendisse sed dolor. Fusce mi lorem, vehicula et, rutrum|Whitney Edwards|UAS54BEP5FM|Mohammad Cannon|1995|available|Sat Dec 06 22:00:42 EAT 2013
CB3C1CD6-055A-8F73-B363-9C5819A05875|75|sem. Nulla interdum. Curabitur dictum. Phasellus in felis. Nulla tempor|Alexa Burnett|ZEV24YYR2GI|Julian D. Wooten|1977|available|Sat Dec 06 22:00:42 EAT 2013
68C08AEE-6E81-2084-C972-2576668C9C0C|76|lobortis risus. In mi pede, nonummy ut, molestie in, tempus|Ori Harding|XQN23GMQ0RK|Hoyt D. Oneill|1978|available|Sat Dec 06 22:00:42 EAT 2013
4A81CC60-BF09-199D-A050-EE32726833AC|77|luctus ut, pellentesque eget, dictum placerat, augue. Sed molestie. Sed|Donna Jackson|BWA07SCC8UU|Fletcher Olsen|1979|available|Sat Dec 06 22:00:42 EAT 2013
E622268C-39EC-D770-1DB6-AF3134EB74DC|78|nonummy. Fusce fermentum fermentum arcu. Vestibulum ante ipsum primis in|Tana Edwards|OVL24YGG3RV|Jayme P. Bullock|1980|available|Sat Dec 06 22:00:42 EAT 2013
CA835401-AF55-1E3E-2A73-4C466B4E6CD9|79|egestas. Duis ac arcu. Nunc mauris. Morbi non sapien molestie|Vladimir Moran|PSR48WOL5QX|Macy Jackson|1981|available|Sat Dec 06 22:00:42 EAT 2013
753CBEA8-CB9B-D1B0-377B-BCB5F629923F|80|rutrum, justo. Praesent luctus. Curabitur egestas nunc sed libero. Proin|Breanna Sanders|HME26ZPV7FR|Blaine Brooks|1982|available|Sat Dec 06 22:00:42 EAT 2013
9AFD333E-A041-850E-111B-ABAEBFD0E8DD|81|vitae diam. Proin dolor. Nulla semper tellus id nunc interdum|Jerome Wyatt|ASX54RCC5YL|Shaeleigh Prince|1983|available|Sat Dec 06 22:00:42 EAT 2013
4F27FA10-3150-41BF-E02F-281CB7D9FDE2|82|felis purus ac tellus. Suspendisse sed dolor. Fusce mi lorem,|Abel Alford|KRA00DBT7BV|Lael N. Delaney|1984|available|Sat Dec 06 22:00:42 EAT 2013
2D788260-5F66-A7B7-F285-405A7787C395|83|Aliquam tincidunt, nunc ac mattis ornare, lectus ante dictum mi,|Alec Knight|TPS89UTS0JD|Jonas N. Baird|1985|available|Sat Dec 06 22:00:42 EAT 2013
80A4254D-D3E8-7415-8C6B-9E2CB5E0DBA8|84|velit justo nec ante. Maecenas mi felis, adipiscing fringilla, porttitor|Joshua Obrien|QCI10KBO5SB|Kelly R. Day|1986|available|Sat Dec 06 22:00:42 EAT 2013
3CAA93E2-BC63-F90D-ACBD-3C7093B06B37|85|ipsum primis in faucibus orci luctus et ultrices posuere cubilia|Candace Travis|HOG09UYX2GK|Steven Keller|1987|available|Sat Dec 06 22:00:42 EAT 2013
A626F5C2-9AED-0B2C-9F20-5DB89D27AC8D|86|ligula. Aenean euismod mauris eu elit. Nulla facilisi. Sed neque.|Cassidy Duffy|PCR23MSH7IQ|Nita I. Alston|1988|available|Sat Dec 06 22:00:42 EAT 2013
BDE32B40-92F3-109A-6D00-782130CA7463|87|litora torquent per conubia nostra, per inceptos hymenaeos. Mauris ut|Stephanie Bowman|YWB64FMN1SI|Sara L. Compton|1989|available|Sat Dec 06 22:00:42 EAT 2013
A395BD98-1E92-8D8E-49B5-284DA0237195|88|vulputate velit eu sem. Pellentesque ut ipsum ac mi eleifend|Baker Hubbard|QYU59GWK8AF|Silas D. Langley|1990|available|Sat Dec 06 22:00:42 EAT 2013
111A7D9B-903C-5DA1-8929-CD1993B4AF0B|89|Nam porttitor scelerisque neque. Nullam nisl. Maecenas malesuada fringilla est.|Maggy Cunningham|AHE63XXG9AX|Wing J. Montgomery|1991|available|Sat Dec 06 22:00:42 EAT 2013
57D0958E-EFA9-222A-DA9D-F9799D457556|90|dolor. Quisque tincidunt pede ac urna. Ut tincidunt vehicula risus.|Rana Spears|UTR76BEG1EE|Rebecca T. Salas|1992|available|Sat Dec 06 22:00:42 EAT 2013
1ACD2EBA-056D-CAE3-8F22-3DA8BF78EEAD|91|in magna. Phasellus dolor elit, pellentesque a, facilisis non, bibendum|Brenden Thornton|XNU50UEM8SQ|Tamekah N. Logan|1993|available|Sat Dec 06 22:00:42 EAT 2013
614D124F-CCC4-FD01-C96B-3179DE76C04B|92|Pellentesque tincidunt tempus risus. Donec egestas. Duis ac arcu. Nunc|Galvin Preston|RHG64BRQ4FD|Murphy Talley|1994|available|Sat Dec 06 22:00:42 EAT 2013
3CC0322B-C52B-BECA-43EE-492A00C2F320|93|Nunc mauris sapien, cursus in, hendrerit consectetuer, cursus et, magna.|Quentin Hudson|HLI45MPM4TW|Sage Q. Colon|1995|available|Sat Dec 06 22:00:42 EAT 2013
2C058EFC-A24D-E2BC-5E0C-84959322EC0B|94|convallis in, cursus et, eros. Proin ultrices. Duis volutpat nunc|Valentine Owens|UVY53ZVQ1FA|Lacey Haynes|1977|available|Sat Dec 06 22:00:42 EAT 2013
499D09C0-D7FE-68A8-3B43-FAE7A256D7AE|95|dolor. Fusce feugiat. Lorem ipsum dolor sit amet, consectetuer adipiscing|Beverly Kirkland|KMV61ILO5JK|Amber Jensen|1978|available|Sat Dec 06 22:00:42 EAT 2013
83CE50A3-49A2-9CF0-446F-D2F0F3FCD3F8|96|in consequat enim diam vel arcu. Curabitur ut odio vel|Anthony Guerrero|IWE40ZAM6UY|Nicholas Harmon|1979|available|Sat Dec 06 22:00:42 EAT 2013
2F43A3A4-69ED-1937-B033-1BFC7D85EBFF|97|tincidunt nibh. Phasellus nulla. Integer vulputate, risus a ultricies adipiscing,|Oleg Stokes|MHZ98TOI9MG|Stacey H. Ellis|1980|available|Sat Dec 06 22:00:42 EAT 2013
4996AC03-168E-9F57-DD69-EFD941B8979C|98|euismod et, commodo at, libero. Morbi accumsan laoreet ipsum. Curabitur|Isaac Shelton|EMQ26TFX1GF|Sloane Delaney|1981|available|Sat Dec 06 22:00:42 EAT 2013
5352EE6C-10E4-0D0A-9D84-B72C0AAF5149|99|tempor erat neque non quam. Pellentesque habitant morbi tristique senectus|Kay Freeman|TLN84FTX0NG|Chantale Lara|1982|available|Sat Dec 06 22:00:42 EAT 2013
12D3FFEF-0C2E-77ED-3355-0FFBEAF7FD1A|100|facilisi. Sed neque. Sed eget lacus. Mauris non dui nec|Cheyenne Nash|KQG59RWF6UP|Brennan C. Martin|1983|available|Sat Dec 06 22:00:42 EAT 2013
